id,corpus,sentence,token,complexity,biomedical,bible,subtitles,wiki,familarity
3ZC62PVYDHATVMOMZJSVD0UPEAMXXE,bible,child levite bore ark god shoulder pole thereon moses commanded according word yahweh,pole thereon,0.7,1,1,1,1,255.0
337F8MIIMZDU0UU1CW1J7BAGB8W40B,bible,took censer put fire laid incense thereon stood door tent meeting moses aaron,incense thereon,0.7,1,0,1,1,252.0
3PGQRAZX02KAZASXA58AX6K611ESY7,bible,shall prepare meal offering morning morning sixth part ephah third part hin oil moisten fine flour meal offering yahweh continually perpetual ordinance,perpetual ordinance,0.7236842105263158,1,1,1,1,0.0
3N7PQ0KLI5P89OQRKPVFIVKER9AE3M,bible,neither pay attention myth endless genealogy cause dispute rather god stewardship faith,endless genealogy,0.7361111111111112,1,1,1,1,0.0
3NFWQRSHVEE19E2BAFM5J7UN7FVFGE,bible,perpetual enmity given child israel power sword time calamity time iniquity end,perpetual enmity,0.75,1,1,1,1,0.0
3D7VY91L65XBO7MHGGY4DMNZO4QMBO,biomed,found similar value plg mouse 50b650129 background j hooverplow shchurin e hart unpublished result,similar value,0.02777777777777779,0,1,1,0,553.0
3NZ1E5QA6Z1DG01BOHHIWKCD290B5N,biomed,result sequence provide facilitate future global study mechanism dynamic olfactory receptor gene expression,global study,0.07500000000000001,1,1,1,0,0.0
3XUSYT70IT170QDU572CAF4MOM10DY,biomed,although great effort put forth eliminate nondonor region direct genetic effect other factor maternal genotype maternal genotype congenic versus control dam differed environmental effect could confound result,other factor,0.07500000000000001,1,1,1,1,540.0
3S1WOPCJFGTJU2SGNAN2Y213N78JEH,biomed,complex trait polygenic growth obesity influenced small moderate direct effect quantitative trait locus qtl epistasis qtl allele environmental perturbation qtlenvironment interaction,direct effect,0.08333333333333331,1,1,1,0,301.0
3RBI0I35XE36FT7IKQ79PYCU9MQY3Y,biomed,known frequent human vwfsyndrome haemostatic disease small defect often clinically silent result physiological change normal condition,normal condition,0.09999999999999998,0,1,1,0,586.5
32CAVSKPCEPTOH9YNLW1YKRKFE31UD,biomed,possible reduction systemic energy utilization related mitochondrial dysfunction lead increased fat mass weight gain pgc1 mouse,weight gain,0.09999999999999998,1,1,1,0,560.5
3HRWUH63QU2FH9Q8R7MRNFC7JYEN5O,biomed,aim present study determine location pendrin cause deafness slc26a4 mouse,present study,0.09999999999999998,0,1,1,0,284.5
3D5G8J4N5A4UAGA7UUQG0CCYL42VT4,biomed,contrast enhancement may rest large part particular property dendrodendritic synapsis principal output neuron mitral cell local inhibitory neuron granule cell olfactory bulb,large part,0.09999999999999998,0,1,1,0,606.5
3K3IX1W4S6RCQ0E22IQ0ZFXOBRGPAS,biomed,large part due lack inhibitor capable specifically downregulating calpains without affecting protease,large part,0.1111111111111111,0,1,1,0,606.5
38RHULDV9YFHGRU1QSW887T3HWOWIY,biomed,recent study yoshioka et al 47 showed misexpression fgf9 chick nephrogenous mesenchyme led expansion gonadal marker gene expression implicating fgf9 gonadal cell proliferation across specie,recent study,0.09999999999999998,1,1,1,0,256.5
3YGYP1364194MWO6OEZUQGH3BG3RN6,biomed,30 qtl identified various experiment 12,various experiment,0.09999999999999998,0,1,1,0,0.0
3NBFJK3IOHIVFRF49I5V6131ZHXOGM,biomed,simple budlike structure initiate formation many organ including lung spinal cord mammary gland hair follicle 1,spinal cord,0.1111111111111111,0,1,1,1,238.5
3KA7IJSNW65H9AJU8WQWUQHUT91PBN,biomed,possibility raised motor neuron may retrogradely transport nt3 muscle spinal cord chen frank 1999,spinal cord,0.2222222222222222,0,1,1,1,238.5
39O6Z4JLX2X1RXJRZ4RDPFX4Y0PXVO,biomed,found spinal cord er81 ko mouse ventral projection proprioceptive axon mostly absent axon made ventral cord,spinal cord,0.3055555555555556,0,1,1,1,238.5
336OE47KI2KM2XE1PZVRNWJXPYKVWU,biomed,few study lca animal model extended examination retinal pathology ultrastructural level,few study,0.1111111111111111,1,1,1,1,296.5
3MQY1YVHS3KLH3IO6YFKYD91IZ92BD,biomed,data add new dimension complexity regulation glycolytic pathway particular cns glycolysis play major role supplying energy proteasome machinery may play critical role modulating component energy supply machinery 43,major role,0.13235294117647056,0,1,1,0,541.0
32ZCLEW0BZKNRTH6WO3DSE071EAPJ8,biomed,transcript could give rise defective calpain small subunit 1030 inappropriate cterminal acid might sufficient support low level calpain activity,low level,0.15000000000000002,1,1,1,0,542.0
3QGHA0EA0J07TJGVKI4RMKPQM64WBP,biomed,hd patient accurate genetic replica hd cag knockin mouse dominant mutation specifically affect major population neuron striatum without impairing huntingtins essential activity embryonic development 5053,essential activity,0.15000000000000002,0,1,1,0,273.0
3RWB1RTQDJNY7CLN5K6M3ORTL3G8P7,biomed,several study used pharmacological manipulation investigate contribution dopamine receptor subtypes various stage associative learning 1214,several study,0.16176470588235292,0,1,1,0,0.0
3HUR21WDDUPIVREW4FEXWE1YGHRXYX,biomed,result suggested might different mechanism motor function swimming rotating rod task,motor function,0.175,1,1,1,0,531.5
3X4Q1O9UBHMCMY43GF110OQ80EEO7J,biomed,first disease may result haploinsufficiency itpr1 concept consistent observation heterozygous deletion lead later onset disorder human whereas homozygous deletion mouse lead early onset disorder able expressed within much shorter life span mouse,life span,0.1764705882352941,1,1,1,0,523.5
39KMGHJ4RZAD16C0TVEHV8K3UXS005,biomed,therefore tgf bmp signaling playing distinct necessary role maintain articular cartilage,necessary role,0.1805555555555556,1,1,1,0,262.0
3W1K7D6QSBHBNEL0V5OYLOJ8388BZU,biomed,huntingtins large number diverse cytoplasmic nuclear protein binding partner strongly suggest huntingtin may participate variety cellular process range trafficking growth factor complex gene transcription reviewed 589,large number,0.19117647058823528,0,1,1,0,616.5
3MJ28H2Y1E8XZUQKSMM424CC98JO54,biomed,different line examined however likely differ genetically capan1 cell brca2 locus also large number additional locus,large number,0.2666666666666667,0,1,1,0,616.5
33NOQL7T9OZSLGNTST4OUMT7V2NZ8J,biomed,since virtually mopsinexpressing cell localized outer edge onl p28 rd7 mutant figure s8 increase mopsin transcript mutant must occurred cell location,outer edge,0.1944444444444444,1,1,1,0,284.5
3QQUBC64ZEEOJSAIXD5MFY3RCXONXY,biomed,however noteworthy low statistical threshold small number animal per group could lead false positive result,positive result,0.19642857142857145,0,1,1,0,311.5
3MVY4USGB6NO9ADS6NM7BIQIBJSIS5,biomed,date few gene reported show specie specific alternative splice variant,few gene,0.19642857142857145,1,1,1,1,296.5
3S1L4CQSFX50ZNP8OFUVNLJK9LTFAF,biomed,genome database search revealed orthologs adam11 adam22 adam23 gene exist vertebrate mammal fish amphibian invertebrate,database search,0.2,1,1,1,0,268.5
3B9XR6P1WEVLNZGWDJLCXUVIKAVJBH,biomed,pathogenesis wide range metabolic disturbance mcad deficiency poorly understood certain aspect patient management controversial,wide range,0.21666666666666667,1,1,1,0,542.0
34R0BODSP1ZBN3DVY8J8XSIY56D5EH,biomed,although property may major contributor maintenance lens clarity early change alphaabko lens indicate much broader cellular function alphacrystallin,major contributor,0.2222222222222222,1,1,1,1,279.0
3HXCEECSQMT70MEB5X2ITZH9OHPZYW,biomed,present obvious explanation result,obvious explanation,0.2222222222222222,1,1,1,0,276.5
3XEDXEGFX3OFEWJ4XOOZESZC8VY0KB,biomed,mouse shh overexpression died le 24 h birth probably owing respiratory failure,respiratory failure,0.2222222222222222,1,1,1,1,271.0
3IVKZBIBJ09ODF28054MB6P3B6DHSB,biomed,stage cholesterol level already lower immediate precursor 7dhc elevated lung study well whole body 1617,whole body,0.22368421052631576,1,0,0,0,601.0
36FFXPMST9O9FNAFTONDR1F2EHAHOE,biomed,committed small cluster epithelial cell placode instructs group underlying mesenchymal cell condense form nascent dermal papilla permanent fixture hair follicle,hair follicle,0.225,0,1,1,1,287.5
3X55NP42EOGC6FFHT3BQC7JI5HO3PA,biomed,obese patient skeletal muscle observed reduced oxidative capacity increased glycolytic capacity decreased percentage type fiber hickey et al 1995 tanner et al 2002,obese patient,0.23214285714285715,1,1,1,1,481.0
3WUVMVA7OB3644G8PRO2QDZ2LQNAZY,biomed,dual color imaging several gfp variant protein attractive prospect become standard procedure cell biology 78,color imaging,0.23214285714285715,1,1,1,1,291.0
3S829FDFT21FXGJ58JRJJTRXYTMDX6,biomed,human patient present hypoglycemia hypoketonemia nonketotic organic aciduria precipitated fasting frequently first 24 mo life 1,human patient,0.2333333333333333,0,1,1,0,567.0
3FBEFUUYRK54GUWXNMRRTF67GMQ6A3,biomed,interesting sox9 transcription factor continues expressed mutant cartilage despite loss col2a1 direct target transcription factor bell et al 1997 lefebvre et al 1997,direct target,0.234375,1,1,1,0,0.0
37S0QRNUFBGD1KM6J34BH2W3WTG88N,biomed,data evidence key role p150caf1 preimplantation development reveal protein required proper 3d organization heterochromatin within embryonic cell nucleus,key role,0.25,1,1,1,0,563.5
3S1L4CQSFX50ZNP8OFUVNLJK9LTAFA,biomed,excluded direct role vesicle formation membrane fusion annexin a7 might act property ca2binding protein 17,direct role,0.234375,1,1,1,0,262.0
356ZPKYPUHHDMIC5IO4G21FVEIJYPB,biomed,aqp2f204vf204v mouse dramatically increased urine production case producing amount urine 24 h exceeds body weight compared heterozygous wildtype littermates,body weight,0.2352941176470588,0,0,1,0,594.0
322ZSN9Z5GKVG3RSAYPTRMCL8K5T4Q,biomed,sam68 protein expression observed throughout developing mouse embryo keeping previous report identified sam68 mrna widely expressed 38,previous report,0.2361111111111111,0,1,1,0,567.5
3NFWQRSHVEE19E2BAFM5J7UN7G6GFS,biomed,although property may major contributor maintenance lens clarity early change alphaabko lens indicate much broader cellular function alphacrystallin,early change,0.2380952380952381,0,1,0,0,287.5
3WRKFXQBOB7L5WP15TEWT4EJS4OYIZ,biomed,relevant gene therapy recent problem gene therapy human highlight importance critical need animal model genetic disease preclinical study,critical need,0.25,1,1,1,0,553.0
30P8I9JKOILSPEZHTY8IXW6K51G5VN,biomed,past experiment seeking explore possible involvement dopamine d2rs associative learning utilized low moderate dos drug 256 sitespecific administration 79 order avoid confounding effect locomotor disruption associated acute d2r blockade learning performance rodent,past experiment,0.25,1,1,1,0,272.5
31J7RYECZLQQ5RM4E7407XV12NA1LJ,biomed,preliminary data wangemann et al unpublished support role pendrin hco3 secretion endolymph,preliminary data,0.25,1,1,1,1,204.5
304QEQWKZPKY4N4JVGGSL9GLS08O0J,biomed,md rat early death caused dysfunction brain stem essential autonomic control respiration hypoxia 24,early death,0.25,0,0,0,0,578.0
3M7OI89LVYOS99TV70NIZAWVGPB6C5,biomed,initial report patient escs attributed unusual erg abnormally functioning rod photoreceptor system persistent activity light adaptation 68,initial report,0.25,1,1,1,0,295.0
3J94SKDEKIP6VXZV2D8ORA0D5UCD5W,biomed,similar observation made type 2 diabetic patient lillioja et al 1987 hickey et al 1995,diabetic patient,0.25,1,1,1,1,269.0
3D1UCPY6GG9R0NG07M9FQLOSG7O38Q,biomed,mrlmp mouse presence lpr gene accelerates development high level broadspectrum autoab production lethal glomerulonephritis addition marked lymphoproliferative disease,high level,0.25,0,1,1,0,558.0
3DFYDSXB2W00JYP2DA272KN69V2JUY,biomed,adult heterozygous female showed mild tendency toward increased urinary output water intake decreased urine osmolality,mild tendency,0.26388888888888884,1,1,1,1,531.5
3XDSWAMB22SLJRCFM91G5FDMGQNCQ8,biomed,neurotrophin3 nt3 key requirement development proprioceptive input motor neuron chen frank 1999 chen et al 2003,key requirement,0.26388888888888884,1,1,1,0,555.5
3JVP4ZJHDPSO81TGXL3N1CKZGR90I0,biomed,identify molecule essential e cell property several group utilized transcriptome analysis identify gene specifically expressed e cell early embryo,several group,0.26388888888888884,0,1,1,0,276.5
3SZYX62S5G0QEOYLB052RIQHJJ957V,biomed,immunoblots protein extract stable cell line showed mdck cell recapitulate glycosylation defect seen mutant mouse unpublished data,unpublished data,0.26388888888888884,0,1,1,1,0.0
3L1EFR8WWT5MU4F3W9GVRQ8033B9FU,biomed,although tried monitor expression lsox5 sox6 postnatal articular cartilage test phosphorylation state sox9 using previously described reagent lefebvre et al 1998 huang et al 2000 unable obtain specific signal late postnatal stage required unpublished data,unpublished data,0.2894736842105263,0,1,1,1,0.0
3SNR5F7R92TNZR8A5S22M1M3ASJIE4,biomed,support view several study demonstrating disruption dopamine signaling via acute blockade dopamine receptor dopamine receptor antagonist 39 6ohda lesion 11011 disrupt phase 1 palatability primary reinforcing characteristic natural reinforcer eg palatability disrupt phase 2 formation incentive salience,several study,0.2647058823529411,0,1,1,0,0.0
3LN50BUKPVBTMJ56Z9FQ8TDZ53FLP6,biomed,however using homologous recombination e cell generate mutant mouse inefficient slow expensive method homologous recombination typically occurs low frequency e cell requiring sophisticated selection scheme screening hundred clone identify desired mutant ii large 1520 kb plasmid often difficult clone required increase targeting efficiency iii breeding mouse homozygosity housing mouse colony generate delay cost,low frequency,0.2647058823529411,1,1,1,0,290.0
3CIS7GGG65JS8I3AZ9RG54AE4N6EU8,biomed,bmp family member known play extremely diverse set role wide variety developmental process 4,diverse set,0.2647058823529411,1,1,1,0,0.0
39I4RL8QGJH5BU0XA484D39XXQAH44,biomed,facilitate functional analysis acdp gene family cloned characterized acdp mouse homologue human acdp gene family,functional analysis,0.2666666666666667,0,1,1,0,254.0
3FI30CQHVKJ9Z41PT0RNOQQDY4B6BY,biomed,moreover observed transcriptional shift ets signaling paired onset appropriate regulation neuronal subtype specification establishment axonal projection target area,target area,0.2666666666666667,0,1,1,0,280.0
36MUZ9VAE626RGSODE1RV46QINBEDY,biomed,plausible model dmrt7 evolved establishment mammalian sex determination help cope ancestral difference gene dosage chromosome pairing recombination meiotic issue arising sex chromosome heteromorphy,sex determination,0.2666666666666667,1,1,1,1,572.0
3KI0JD2ZU1IMXSYZGJF7JO4HFEK67C,biomed,switch control sex determination biologically diverse,sex determination,0.296875,1,1,1,1,572.0
3V8JSVE8YYQ9PRNF9AO58PGR0BHEY6,biomed,two spontaneous mutant 1 itpr1deficient mouse 4 generated gene targeting decreased itpr1 expression associated autosomal recessive movement disorder figure 1,movement disorder,0.275,1,1,1,0,0.0
3EGKVCRQFWSBIOBVZJMF7HA6XE4BY3,biomed,dna repair enzyme repair frequent damage dna caused oxidant stress well stress including bulky adduct derived carcinogen cigarette smoke 8,frequent damage,0.2763157894736842,1,1,1,0,279.0
36U4VBVNQODHHM8FLFBG4B9XJCVUR0,biomed,based data crx hypothesized play critical role differentiation maintainance photoreceptor cell 57,critical role,0.2763157894736842,0,1,1,0,520.5
3VGZ74AYTGGU62I1JDW4B19KA3ECGD,biomed,result demonstrate important epistatic interaction gene 129 c57bl6 genome development autoimmunity illustrate important effect background gene analysis interpretation autoimmune phenotype associated targeted genetic disruption,important effect,0.2777777777777778,0,1,1,0,613.0
3OQQD2WO8I6KPTSDG8L63AI6J3TI3D,biomed,homozygous mouse conditional allele viable indistinguishable normal mouse allowing u study role apc tissue temporalspecific manner,normal mouse,0.2794117647058824,0,1,1,0,561.0
3N7PQ0KLI5P89OQRKPVFIVKERAM3EP,biomed,however susceptibility locus mapped similar chromosome location different strain suggesting least susceptibility may shared amongst lupusprone strain,different strain,0.2794117647058824,0,1,1,0,545.5
3LN3BXKGC0V3K0O604W5NVGN2JWWG6,biomed,finding raise many question possible role alphacrystallin nucleus cell cycle regulation differentiation,many question,0.2794117647058824,1,1,0,0,593.5
3D4BBDG7ZHWTCQ6DOYPKS7KB6Y9C35,biomed,mcaddeficient patient abnormal plasma urine metabolite associated medium chainlength enzyme specificity,medium chain,0.2794117647058824,1,1,1,0,256.5
3BFNCI9LYKQN09BHXHH9CLSX5NI373,biomed,many dimorphism affect somatic cell sexual dimorphism directly mediate sexual reproduction gamete,sexual reproduction,0.2794117647058824,1,1,1,0,288.0
3BDORL6HKKDLVSRFZOQGA5NRCCPRCO,biomed,adult spinal cord motor neuron express high level nt3 cell including glia also express zhou rush 1994 dreyfus et al 1999 buck et al 2000,high level,0.28125,0,1,1,0,558.0
3CMV9YRYP31X08284WA6BXRNW49LJ6,biomed,same mechanism seems apply vivo aqp2f204v mouse,same mechanism,0.2833333333333333,1,1,1,1,284.5
3W0KKJIARR9XWLO7SS1E775URTA8K6,biomed,employed same approach analyse genetic basis disease inheritance 129  c57bl6 hybrid strain common genetic background genetargeted mouse,same approach,0.2833333333333333,1,1,1,1,538.5
3VW0145YLYCH6QKT48BLBA6CW9ZJM6,biomed,new information current work includes 1,new information,0.2833333333333333,1,1,0,0,602.0
3538U0YQ1FU0F2QNF0FL0D5E3B13F7,biomed,abnormal lysosomal storage body large vacuole found skin conjuctival biopsy using electronmicroscopy prior gene identification served only mean diagnosis 35,only mean,0.2857142857142857,1,1,1,1,569.5
3NCN4N1H1GHH6P7HSHD4Q1CZTU0BND,biomed,mouse without intact dopamine d2rmediated signaling displayed similar decrease latency retrieve unhidden food pellet fig 1 learned dig food buried unscented sand fig 2,unscented sand,0.2875,1,1,1,1,259.5
3Y40HMYLL1I1EIURUEH8TTVLKTGUXW,biomed,mutation either gdf5 closely related gdf6 gene also block formation joint specific location providing strong evidence molecule essential joint formation process storm et al 1994 settle et al 2003,specific location,0.2894736842105263,1,1,1,0,0.0
3CESM1J3EI31N7Z0ORNJB43Y85T6WE,biomed,conclusion consistent finding severely reduced level huntingtin hypomorphic hdh allele lead abnormal brain later embryonic development 15,embryonic development,0.2894736842105263,0,1,1,1,268.0
3VI0PC2ZAYK61DAUYS5ZUN3W27TOXE,biomed,although mechanistic understanding deficiency cholesterol biosynthesis lead abnormal embryonic development lacking frequently advanced explanation shh signaling involved early developmental patterning may disrupted,embryonic development,0.475,0,1,1,1,268.0
3UL5XDRDNCJUE234L5X85IMCU3F85L,biomed,finding represent novel role tbox gene action embryonic development provide evidence previously unappreciated complexity acquisition dorsoventral positional identity mammalian skin,embryonic development,0.6,0,1,1,1,268.0
3R15W654VDTEMV6LZMUF8Y39AZ1QL2,biomed,recent study floxed allele suggest bmpr1a also required many later developmental event role bone joint formation yet tested mishina 2003,joint formation,0.2941176470588235,0,1,1,0,499.0
3R16PJFTS3RWDK15GPB1QVPPP7DK4A,biomed,addition level bmpr1a mrna protein may persist time following gdf5cre stimulated recombination making possible bypass early requirement bmpr1a joint formation location,joint formation,0.45,0,1,1,0,499.0
31MCUE39BKM6T2MIQKL3IY5Q4Q1G3J,biomed,site loss bmpr1a function lead defect early stage joint formation resulting complete failure form joint fusion bone ankle,joint formation,0.4705882352941176,0,1,1,0,499.0
3P6ENY9P79WZJ1ZCVTA874JG28BIHK,biomed,efw assisted production alphaabko mouse experimental design initial fixation sample,experimental design,0.2941176470588235,1,1,1,0,269.0
3FI30CQHVKJ9Z41PT0RNOQQDY4BB63,biomed,second independent study powell able compare derivative capan1 differed ability express fulllength brca2 protein powell personal communication 2001,personal communication,0.296875,1,1,1,0,543.0
3VDI8GSXAFTSUZSO21GZ9FD1KCTG8B,biomed,currently held excitatory dopamine d1rs mediate acquisition expression several conditioned behavior involving food reinforcer eg 67 well responding conditioned cue predictive cocaine delivery 9  consistent interpretation d1r mediated signaling might modulate maintenance stimulusresponse outcome,cocaine delivery,0.296875,1,1,1,1,0.0
3LG268AV3860SQBTVFWB0TNUXO2ER4,biomed,one curious finding rd7 mutant retina occurrence two different type change increase number sopsinexpressing cone transformation rod hybrid photoreceptors,curious finding,0.30000000000000004,1,1,1,1,0.0
3I6NF2WGIGW97H9M439WXV3AIMS5GY,biomed,although overexpression calpastatin endogenous protein inhibitor  mcalpain provides important approach effort distinguish isoform specific function 242627,important approach,0.30000000000000004,1,1,1,0,566.0
3KTCJ4SCVG1AB94PEJ5F7AAQ2S01ML,biomed,although advance medical management pulmonary hypoplasia may decreased mortality associated cdh patient survive receive care highvolume center 23 populationbased mortality reported great 62 large number death prior birth transfer tertiary care facility 4,medical management,0.30000000000000004,1,1,1,0,259.0
3MZ3TAMYTLNC8VDFRYM2L8LMPH9IRH,biomed,alphacrystallin may play functional role cell nucleus may role regulating cell cycle,functional role,0.30000000000000004,0,1,1,0,516.0
3MNJFORX8B43THDRTJ3EFA3YH7S5FZ,biomed,question whether antinuclear autoimmunity due genetargeted mutant gene normal 129 gene expressed same region targeted gene,same region,0.3026315789473685,1,1,1,1,540.0
3909MD9T2ZH3P06K4KWHJ49BU0REF9,biomed,testis ovary represent two divergent pathway development bipotential embryonic gonad,divergent pathway,0.3035714285714286,1,1,1,1,0.0
3B9J25CZ25DXW7RSEDQL0FSNYE8CSX,biomed,vesicle formation go along several change red blood cell like cytoskeletal rearrangement change phospholipid orientation cellular membrane,blood cell,0.3055555555555556,0,1,1,0,545.5
3J9L0X0VDFMO5Q1YMYQVVEU0Y61W9F,biomed,data suggest basis performance deficit rotating rod task syt iv mutant motor coordination rather motor learning,motor learning,0.3055555555555556,1,1,1,0,555.0
3OKP4QVBP2X6DNL3ZZ0D56JWA0TAG9,biomed,pw designed coordinated immunocytochemical morphometrical molecular biological experiment,biological experiment,0.3088235294117647,1,1,1,0,0.0
3FJ2RVH25Z62TA3R8E1O77EBUZ6293,biomed,also clear genetic system raised production a level found human accelerate pathology experimentally feasible time frame,time frame,0.3088235294117647,1,1,1,0,549.0
3XDJY5RK5SLAGG6HA3F3WIYNRYCU4I,biomed,gdf5cre system provides new method restricting gene expression inactivation primarily articular region thus avoiding pleiotropic function many gene tissue,new method,0.3088235294117647,0,1,1,0,585.0
3BJKPTD2QCC2H9TQLAL6ZFNV0YPRT7,biomed,dlb conceived designed study carried sample preparation confocal microscopy scanning electron microscopy statistical analysis drafted manuscript,statistical analysis,0.3088235294117647,1,1,1,0,0.0
3R5OYNIC2C9H5WDB8IHHUKNGZG0PTC,biomed,deh allele caused large deletion remove tbx15 coding sequence pleiotropic phenotype caused simple loss function tbx15 rather dominantnegative contiguous gene effect,simple loss,0.3125,1,1,1,0,581.0
37OPIVELUU3KDJGEJ5IVQ6VXP06HAF,biomed,consistent expression found mutant male germ cell arrest pachynema undergo apoptosis although small proportion progress diplonema sometimes beyond,small proportion,0.3125,1,1,1,1,572.5
37SQU136V7ODFKI0LXMHNIMN4H411C,biomed,first possible two distinct type rod precursor loss nr2e3 one lead scone fate result hybrid cell type,cell type,0.31666666666666665,0,1,1,0,543.5
3TZ0XG8CBUKDFP5GOVAPHYREGZY98D,biomed,reported xenopus adam11 ortholog xmdc11a expression pattern associated neural development proposed role cell migration 24 reported analysis using northern blot situ hybridisation method murine adam11 gene expressed developing adult nervous system 1925,nervous system,0.31666666666666665,1,1,1,0,580.0
3EKTG13IZU3N1G8T7TNYRPJ40Y4LMA,biomed,finding led u hypothesize adam22 integrin binder play important role nervous system adam23,nervous system,0.33333333333333337,1,1,1,0,580.0
35F6NGNVM8JSZQ9BCWN0UYWVZMVT7A,biomed,mouse e cell show caf1 also required regular level h4k20me3 pericentric repeat iap element repeated sequence spread mouse genome,regular level,0.31666666666666665,1,1,1,0,542.0
3EHVO81VN5LOJV3ENMP2F52UL611HC,biomed,female male inherit average gene may risk factor expression effect disease risk varies significantly,disease risk,0.3194444444444444,1,1,1,0,548.5
335VBRURDJ0UOQF71YWP98N0R2WE9H,biomed,thus targeted genetic disruption candidate gene encoding protein immune system extensively used examine role immune regulation,immune system,0.3194444444444444,1,1,1,0,294.0
3EN4YVUOUCSS02JXIFDUMRMA3DIXJ3,biomed,phenotypeincreased urinary output water intakeshowed complete concordance homozygosity f204v mutation 58 animal tested,water intake,0.3194444444444444,1,1,1,1,320.5
36FQTHX3Z3RA2LE7AYTPHNETOD9B3X,biomed,report dopamine d2rmediated signaling must intact mouse efficiently learn associate food reinforcer specific odor adaptively disengage inappropriate behavioral strategy following reversal reinforcement contingency,specific odor,0.3214285714285714,1,1,1,1,0.0
3SD15I2WD2U4W9XCE7CH67S1ACY637,biomed,show utility investigating spontaneous mouse mutation understanding human disease,human disease,0.32352941176470584,0,1,1,0,588.0
3YZ7A3YHR5TCXMIDZ33DM9MD6XM5SI,biomed,objective present study create genetically engineered murine model msud mimic pathology classic intermediate variant form human disease,human disease,0.3382352941176471,0,1,1,0,588.0
338431Z1FLFM4HOIPTZ755H81Q8ORI,biomed,study focused role dna methylation histone modifying enzyme 3 data point importance chromatin assembly machinery,data point,0.325,0,1,1,0,269.0
