id,corpus,sentence,token,complexity,biomedical,bible,subtitles,wiki,familarity
3PKJ68EHDNWVECJIDBV8J5YGFONHJK,europarl,first item agenda scheduled last 430 pm,first item,0.2222222222222222,1,1,1,0,567.5
3HYV4299H0WUALWXW6QB9CSP7X18EB,europarl,mr giansily mentioned witnessed yesterday evening,yesterday evening,0.22368421052631576,1,1,1,1,315.0
36D1BWBEHN1H0UMLXN5TCTKVUZ0M2B,europarl,sk madam president supported european initiative youth move aim reduce proportion student leaving education early 15 10 2020 increase proportion people university education 31 40,university education,0.225,1,1,1,0,603.5
38B7Q9C28G5QBBMSVGDRXKVNA7E690,europarl,arrested year ago drafting charter 08 charter signed 10 000 ordinary chinese citizen demanding normal thing democratic society right free speech open election rule law,chinese citizen,0.225,1,1,1,0,267.5
3OYHVNTV5TY0HDBNZ9QA4TVU6Z1KOA,europarl,year ago policy put asset disposal european recovery package thereby also providing essential link exit strategy real economic crisis one hand longterm sustainable growth structural transformation,sustainable growth,0.23214285714285715,1,1,1,1,280.0
3FTID4TN8LYNVXX7QWB9LK6B995LYP,europarl,also allow easy compensation thousand accident involving vehicle one member state,easy compensation,0.23214285714285715,1,1,1,1,303.5
3A520CCNWN08T9PCT4AP53YKXL1AEH,europarl,first found quite difficult determine intelligent transport system actually include many different thing,different thing,0.2333333333333333,1,1,0,0,572.5
3BO3NEOQM0HK9ERYPN0GQIWCPE8AIQ,europarl,true particular link remarkable woman one first sakharov prize 1990 20 21 year life spent nearly 15 year prison,remarkable woman,0.2333333333333333,1,1,1,1,311.5
3GL25Y6843UI1APILCQM2JER780XMW,europarl,aware general deterioration situation human right defender democratic republic congo particularly worrying,democratic republic,0.2333333333333333,1,1,1,0,229.0
30IRMPJWDZJ3EQ33R17EYO0ZHMLKRJ,europarl,peace need achieved rule law established society saved poverty trap eastern province democratic republic congo,democratic republic,0.4347826086956522,1,1,1,0,229.0
33TGB4G0LPHME5F2U9RYOX9J1GXTXU,europarl,believe important economic aid higher allocated date make possible increase link balkan state europe develop tourism allow balkan citizen young old live better life,economic aid,0.234375,1,1,1,0,268.0
3UQ1LLR26A8MZFZ4AQXTIYO46I2AL4,europarl,review quite rightly observes transport service play key role economy society inseparable latter recommendation therefore integrate fully lisbon strategy,key role,0.234375,1,1,1,0,563.5
3EQPA8A374WH5XJCJX1FJC2LBE4JZC,europarl,fourthly report vittorio prodi brief presentation scheduled today moved question time thursday 6 may 2010 immediate vote,brief presentation,0.2352941176470588,1,1,1,0,261.5
3LCXHSGDLT6CT5B6A4WGQ3SQJR8ESH,europarl,would also like stress european parliament continued effort appeal complete stop physical mental violence woman many year,complete stop,0.2352941176470588,1,1,0,0,584.0
3O2Y2UIUCQU6B0YU067KHZMGEYAKFO,europarl,first thing tell possibility sort instruction within parliament ruled absolute certainty,absolute certainty,0.2368421052631579,1,1,1,1,247.5
3S1WOPCJFGTJU2SGNAN2Y213N8VEJ1,europarl,40 000 people made homeless main quake numerous aftershock,main quake,0.2368421052631579,1,1,1,1,524.0
3J9UN9O9J3SK3CDMF3ONDDZZT7LJ0K,europarl,believe would good idea provide help inuit people achieve peace tranquillity far way life way living way hunting concerned also achieve greater respect regard european union leader programme scandinavian country seal hunting,good idea,0.2375,1,1,0,0,603.0
3H781YYV6TID85OLZ41608OCLAMTEL,europarl,second amendment compare statement made pope human right violation serious kind use death penalty human right violation china torture everywhere,death penalty,0.25,1,1,1,0,290.5
3T2EL38U0MK9MPNAD5X3JSYWH9YQXD,europarl,social service general interest vote,general interest,0.25,1,1,1,0,570.0
3PUV2Q8SV448KDG43NZ1UW05FRLBDK,europarl,investment policy fail take account either,investment policy,0.25,1,1,1,0,0.0
3GV1I4SEO9PLCDN1KDGH2TMIAZCL6P,europarl,political agreement proposal dealing circulation information fortunately reached council interior minister luxembourg 13 june,political agreement,0.25,1,1,1,0,270.5
33BFF6QPI1B2QOCI5PPL41REYFEW3N,europarl,let u observe minute silence memory tunisian friend,tunisian friend,0.25,1,1,1,1,301.5
3LG268AV3860SQBTVFWB0TNUXPPRE6,europarl,member parliament engaged illegal activity would expect russian authority protect u violent criminal certainly arrest u dubious ground,illegal activity,0.25,1,1,1,0,0.0
3IZPORCT1F9CC02VLG4HLWK7P5HRHM,europarl,often told regulate financial market capital leave european market,european market,0.25,1,1,1,0,259.0
3P4ZBJFX2V3X60SBPKQN5AGB15JFWF,europarl,two politician country dominate political scene affect like interconnecting pipe,political scene,0.25,1,1,1,0,263.0
3TZ0XG8CBUKDFP5GOVAPHYREG0L982,europarl,mr killilea observation course courtesy must thank think minute proper place portray reaction comment way sitting conducted conducted,proper place,0.25,1,1,1,0,579.0
3U18MJKL1UM0GUZN6H9Z1LIHBGNNCL,europarl,agreed emission reduction international transport despite resistance corner put figure global financial need developing country fight climate change,climate change,0.25,1,1,1,0,0.0
3V8JSVE8YYQ9PRNF9AO58PGR0C4YEF,europarl,historic day northern ireland given interest support peace process would behalf member parliament send strong message support implementation good friday agreement wishing elected member well work building peace community northern ireland,building peace,0.25,1,1,0,0,589.0
3L60IFZKF3IZN6OSPBSN7SI12WJHHF,europarl,particular situation woman prison impact imprisonment parent social family life debate,family life,0.25,1,0,0,0,602.5
3B286OTISEHG4PB475LG2JBC2TXAJ2,europarl,lastly wish say situation complex finely shaded even mr fontaine own party standing municipal election france bayonne biarritz anglet coalition basque nationalist party including mr gorostiaga party favourite mine imagine favourite mr fontaine either,own party,0.25,1,1,1,1,608.5
3L84EBDQ372HRMQ81HYHXCELMURKKQ,europarl,say never succeed win democratic process northern ireland spoken must win,northern ireland,0.25,1,1,1,0,0.0
31SIZS5W59FPPT1Y46RBUAC8GSDRQI,europarl,urgent need provide access spacebased intelligence system member state common basis,urgent need,0.25,1,1,1,1,294.5
3WPCIUYH1A88GZAL39QMUQ6RLYLDTC,europarl,lady gentleman immensely sad duty  duty predecessor carry previous occasion  open september session mentioning terrorist attack suffered world,terrorist attack,0.2608695652173913,1,1,1,0,271.0
35JDMRECC499302FF42Z1P9NVGEGEZ,europarl,however unequal trade relationship only cause concern another case unsafe product coming china,only cause,0.2608695652173913,1,1,1,1,578.5
3P888QFVX3UMSG9ICEA70F7355TQO8,europarl,title legislative act published minute sitting,legislative act,0.2631578947368421,1,1,1,0,283.0
3OWZNK3RYLP0D2RU6PWF331P7L3U2B,europarl,capital requirement trading book resecuritisations supervisory review remuneration policy,trading book,0.26388888888888884,1,1,1,0,321.5
360ZO6N6J1JS0E7KIWK8MGS905AM93,europarl,record part said,record part,0.2647058823529411,1,1,1,0,594.0
3KTZHH2ONIFSM9OAD4EUMKXYGZSM8E,europarl,responsibility belgian investigation body carry,investigation body,0.2647058823529411,1,1,1,0,555.5
30QQTY5GMKK7Z3O0C1DAZUIXI1PU7R,europarl,establishing european agency management operational cooperation external border member state european union agency generally known frontex regulation ec 20072004 important step promoting solidarity,european agency,0.2647058823529411,1,1,1,0,210.0
3W5PY7V3UP7H0797NBZW55TJ5K0JYL,europarl,trafficking human being vote,human being,0.2647058823529411,1,1,1,0,582.0
37MQ8Z1JQEWHUBBZGQT46O7239DY2C,europarl,want emphasise believe reflects feeling many fellow member including group,fellow member,0.2678571428571429,1,1,1,0,524.0
35U0MRQMUJ7EXO5ZYD4H626BMX8VO7,europarl,mr poos known opposition turkey personal link government cyprus,personal link,0.2678571428571429,1,1,1,0,513.5
39HYCOOPKOL434K1UCPA8CBZRQPDMB,europarl,agency gradually become important financial world variety reason,financial world,0.2678571428571429,1,1,1,0,303.5
3Q9SPIIRWJM2A9B3E44VR95K4P6AWX,europarl,committee legal affair internal market studying carefully came view reported back satisfactory legal basis could devised proposal,legal basis,0.2678571428571429,1,1,1,0,0.0
371DNNCG442WZ4EUM1F68YSQA7O8T1,europarl,separate issue ongoing debate legal basis,legal basis,0.2717391304347826,1,1,1,0,0.0
3O4VWC1GEW6GK4CJYQ66FBX6WJ5J3F,europarl,proposal council decision establishing period 20072013 specific programme fundamental right citizenship part general programme fundamental right justice c602362005,fundamental right,0.27380952380952384,1,1,1,0,299.5
35NNO802AVWRTXLNYR5LCOGCOL7NIN,europarl,could done charter fundamental right,fundamental right,0.36764705882352944,1,1,1,0,299.5
3ACRLU860NEDCJU4ZIAL0EIQF3MBED,europarl,next item report mr romeva rueda behalf committee fishery proposal regulation european parliament council establishing catch documentation programme bluefin tuna thunnus thynnus amending regulation ec 19842003 com 20090406 c701422009,bluefin tuna,0.27380952380952384,1,1,1,1,0.0
35U0MRQMUJ7EXO5ZYD4H626BMZQVOT,europarl,current working condition sector complex demanding classroom heterogeneous social cultural point view teaching concentrate individual learning teacher gone excathedra trainer classroom manager requirement good knowledge foreign language information communication technology known ict mean transmitting knowledge able use teaching tool,good knowledge,0.275,1,0,1,0,598.0
3NZ1E5QA6Z1DG01BOHHIWKCD2ANB5C,europarl,report deal need u open border,open border,0.275,1,0,1,0,535.0
3566S7OX5DJRQ6X2AD3QOSD074S17Z,europarl,far proved hardly surprising one might say somewhat difficult enterprise,difficult enterprise,0.275,1,1,1,0,203.5
3BCRDCM0ODUAS75JZD4GNT93LZ7K6L,europarl,contains ambitious cohesive set measure field social policy enabling european grasp opportunity open,social policy,0.275,1,1,1,0,248.5
308KJXFUJR6AIS79JZZK4PYL0VOTAQ,europarl,therefore believe mr van nistelrooijs report step right direction also believe follow putting resource resolving emergency matter connected social housing,social housing,0.2763157894736842,1,1,1,0,248.5
371QPA24C2OEO4U9NG6RTO5IW1IT12,europarl,mr president lady gentleman thanks careful investigative work carried european commission able put rigidity characteristic retail banking service spotlight,investigative work,0.2763157894736842,1,1,1,1,301.5
385MDVINFCFDB2E78AH8K883UC0WJZ,europarl,welcoming refugee equitable approach,welcoming refugee,0.2777777777777778,1,1,1,1,0.0
3Z56AA6EK405IV5MKPHW2617A42M6S,europarl,wish say few word background,few word,0.2777777777777778,1,1,1,1,296.5
30Y6N4AHYPWV0KXTZKLRUB59XDORDD,europarl,resolve issue reform judiciary public administration resolve issue shipping industry croatia still much,shipping industry,0.2794117647058824,1,1,1,0,279.5
337F8MIIMZDU0UU1CW1J7BAGBAW40F,europarl,aim establish safe harmonised framework european union level monitor supervise risk presented manager investor counterparties actor financial market financial stability making possible manager subject observing strict requirement provide service market fund throughout internal market,financial market,0.2794117647058824,1,1,1,0,259.0
3HA5ODM5KASTVGXS5ULQQ7GCJMBVS4,europarl,taken good note commitment revise constitution hold parliamentary presidential election honour international treaty obligation limit military rule six month,military rule,0.2794117647058824,1,1,1,0,496.0
3J6BHNX0U9SIZSBBYUQXP4VPGPWNKY,europarl,candidate particular need demonstrated strong capability commitment multilateral coordination great knowledge international economic financial monetary affair,strong capability,0.2794117647058824,1,1,1,1,301.5
3UL5XDRDNCJUE234L5X85IMCU4285A,europarl,however knowledgebased economy need increasingly better skilled labour force,labour force,0.28125,1,1,1,1,555.5
366FYU4PTGPE5MYY5VNEZH1G2XVEK0,europarl,data constitute serious threat patient also european producer,european producer,0.2833333333333333,1,1,1,0,0.0
3IHWR4LC7DD6QQYJSPG2URQHZQ8I8U,europarl,alliance replace humanitarian assistance help minimise extent expected catastrophe providing support innovative programme strengthening administrative structure national local level also educating inhabitant threatened island state,local level,0.2833333333333333,1,1,1,0,252.0
3PKJ68EHDNWVECJIDBV8J5YGFONJHM,europarl,matter acknowledging egypt least done something asking intervene quickly immediately free hostage urging country never use lethal force repel people crossing sinai,lethal force,0.2857142857142857,1,1,1,1,276.0
3TZDZ3Y0JS6V4PLVPA1A2O462UF91I,europarl,moved sympathy outrage week ago sight innocent palestinian civilian including many child lost life gaza disproportionate use military force since last thursday appalling murderous attack school jerusalem sharing sadness anger israeli population,military force,0.2857142857142857,1,1,1,0,505.0
374UMBUHN5PYB7473DVBAKO90Y9TCS,europarl,oral question written declaration submission see minute,oral question,0.2857142857142857,1,1,1,0,545.5
3RTFSSG7T86J6S27BVTL0NLVY15LWQ,europarl,however think disease discussed today namely multiple sclerosis problem dramatic scale parliament involvement justified,dramatic scale,0.2857142857142857,1,1,1,0,261.5
3URJ6VVYUPNF3BMKEH3UXC6Y9DBO4O,europarl,year seen huge increase number product recent estimate indicate one half million medicine sold illegally europe particularly via internet,recent estimate,0.2857142857142857,1,1,1,0,509.0
3ZTE0JGGCESIYFZZ7W9CGAIM1QSOC1,europarl,roaming public mobile network signature act,mobile network,0.2875,1,1,1,0,0.0
32204AGAABCLNATH55A5MS60NW6HGG,europarl,like european partner bulgarian citizen must show greater resolve decisiveness fighting corruption organised crime securing reliable effective control european fund used,european fund,0.2875,1,1,1,0,0.0
3KTCJ4SCVG1AB94PEJ5F7AAQ2TMM1U,europarl,same spirit guide shared colleague french government,same spirit,0.2875,1,1,1,1,543.5
3OEWW2KGQJBS375D7S4N0G04MQ4OD1,europarl,eu agriculture climate change,eu agriculture,0.2875,1,1,1,0,0.0
30Z7M1Q8UYKRK8FLG1OPDT2YMI3A8I,europarl,next item report stphane le foll behalf committee agriculture rural development eu agriculture climate change sec20090417,eu agriculture,0.3833333333333333,1,1,1,0,0.0
3LOJFQ4BOXF9DGKY90CUTZJV2LUDK6,europarl,eu agriculture climate change short presentation,eu agriculture,0.4736842105263158,1,1,1,0,0.0
3OCZWXS7ZO7PT9NNFU6CAN8IE41L59,europarl,next item debate oral question commission helmuth markov behalf committee international trade recent development negotiation free trade agreement european union gulf cooperation council b600202008,recent development,0.2894736842105263,1,1,1,0,524.5
38G0E1M85M59ATPWUZGQ58Y04JWVUK,europarl,ro mr president taking psychotropic psychoactive substance generally lie legislative grey area much harmful effect drug currently known,psychoactive substance,0.2894736842105263,1,1,1,1,253.0
3KG2UQJ0MJO4AV96BZAULQ7YFVONQQ,europarl,firstly political dialogue,political dialogue,0.2894736842105263,1,1,1,0,0.0
31KSVEGZ34SU9QXKGFQHMZUU4TURWM,europarl,case fishery product measure applied raw material used product solely intended consumption local market,raw material,0.2941176470588235,1,1,1,0,534.0
3GS542CVJVNUS7MEQX3M5EHNEAK950,europarl,culmination deficient enforcement european legislation refuse past 14 year italy repeatedly condemned court european community,european community,0.2941176470588235,1,1,1,0,249.5
3AJA9FLWSCYF558603M84J73MULIFB,europarl,report mr pack behalf committee foreign affair proposal council commission decision conclusion stabilisation association agreement european community member state one part bosnia herzegovina part c6 02552008,european community,0.368421052631579,1,1,1,0,249.5
3YGE63DIN8X69WDLM27223T7V3UW0S,europarl,bulgaria export electricity neighbouring country numerous member house repeatedly drawn attention enormous social economic environmental damage would caused problem would ensue form increased dependence import problem obtaining reliable energy supply reactor closed,environmental damage,0.2941176470588235,1,1,1,0,279.0
36U4VBVNQODHHM8FLFBG4B9XJDJRUN,europarl,oral question commission palestinian prisoner israeli jail b601672008,israeli jail,0.2941176470588235,1,1,1,0,269.5
3KA7IJSNW65H9AJU8WQWUQHUTAOBPY,europarl,oral question council palestinian prisoner israeli jail b601662008,israeli jail,0.4285714285714286,1,1,1,0,269.5
3CRWSLD91K4V71BQKL3QJ6NYV4WOMJ,europarl,such cooperation requires special european crisisresponse mechanism working collaboration european civil protection force,such cooperation,0.2941176470588235,1,1,1,1,260.5
3ZLW647WALVGE8EBR50EGUBPU8J32C,europarl,active inclusion people excluded labour market,labour market,0.2954545454545454,1,1,1,1,538.5
3SSN80MU8CONBMPF00D6N6MNI35XKR,europarl,final draft agenda drawn pursuant rule 110 110a rule procedure conference president meeting thursday 12 december distributed,draft agenda,0.296875,1,1,1,1,0.0
3Z3R5YC0P3N5EJOHUFLCIQ9CXB1FTP,europarl,decided hold lahti summit want give head state government member state union opportunity open informal debate two theme important union future economic success innovation external energy relation,informal debate,0.296875,1,1,1,1,229.5
3KI0JD2ZU1IMXSYZGJF7JO4HFF7671,europarl,oral amendment accepted,oral amendment,0.296875,1,1,1,0,453.0
3BDORL6HKKDLVSRFZOQGA5NRCDCRCD,europarl,madam president lady gentleman oral amendment group proposing involves replacing word form glorifying word apology,oral amendment,0.3382352941176471,1,1,1,0,453.0
3SA4EMRVJV2GPNGKAGT7A9LB26R0P1,europarl,according indication sitting service mr tannock oral amendment tabled case amendment 2 rejected,oral amendment,0.359375,1,1,1,0,453.0
3ROUCZ907FUJ74W2X1I3BAC3Q4BOOY,europarl,parliament rejected oral amendment,oral amendment,0.38235294117647056,1,1,1,0,453.0
3ACRLU860NEDCJU4ZIAL0EIQF3MEBG,europarl,parliament agreed accept oral amendment,oral amendment,0.5147058823529411,1,1,1,0,453.0
3D42WVSDH8V1V5NB4L8BQ71RCDJYFX,europarl,crucial support involvement university representative scientific community researcher strategic partner,strategic partner,0.296875,1,1,1,1,277.5
3A9LA2FRWSEW9WO7UFA9AE6VQM1XHN,europarl,mr president important resolution condemning french government policy destroying illegal traveller camp voted,illegal traveller,0.30000000000000004,1,1,1,1,247.0
3S1L4CQSFX50ZNP8OFUVNLJK9MGAFZ,europarl,2007 world trade totalled nearly 16 billion dollar 31 global gdp european union alone accounted 20 total volume global import export,global import,0.30000000000000004,1,1,1,0,255.5
3BVS8WK9Q0VPSOWQV10CLTGI7WTIBT,europarl,mr president commissioner tajani lady gentleman would like start offering sincere thanks shadow rapporteur committee internal market consumer protection helped produce report everyone contributed splendid result,splendid result,0.30000000000000004,1,1,1,1,566.5
3QTFNPMJC6IDONAXYVT7CJJ2KY9NZK,europarl,irrespective question legal jurisdiction european union undoubtedly bear political responsibility shoulder responsibility together,legal jurisdiction,0.30000000000000004,1,1,1,1,0.0
324N5FAHSXBV7XKK0LCOZLP22SYKVC,europarl,could parliament aside showing indignation send strong symbolic message promote diversity tolerance required globalised world forcefully condemning such remark,such remark,0.30000000000000004,1,1,1,1,539.5
304QEQWKZPKY4N4JVGGSL9GLS1VO08,europarl,currently legal basis organising information communication strategy therefore establishing action controlling properly,communication strategy,0.30000000000000004,1,1,1,0,263.5
3IJ95K7NDXCDX6FS835IRC3W98FNGV,europarl,payment service internal market vote,internal market,0.3026315789473685,1,1,1,0,259.0
3AXFSPQOYQYB0GSCIL78GKM3Z9AJFO,europarl,believe another region world experience establishing internal market common rule common institution indeed single currency solidarity cohesion policy,internal market,0.3026315789473685,1,1,1,0,259.0
31SIZS5W59FPPT1Y46RBUAC8GSDQRH,europarl,monitoring export agricultural product receiving refund amount vote,agricultural product,0.3035714285714286,1,1,1,0,281.0
3NFWQRSHVEE19E2BAFM5J7UN7HTGFH,europarl,importantly demonstrates ukraine attachment european value,european value,0.3043478260869565,1,1,1,0,276.0
3MQY1YVHS3KLH3IO6YFKYD91I0WB2B,europarl,today however speaking flood done european level,european level,0.3043478260869565,1,1,1,0,252.0
3LG268AV3860SQBTVFWB0TNUXPPERT,europarl,first ground group agreement environmental ground supplementing evaluated european level,european level,0.3382352941176471,1,1,1,0,252.0
3YKP7CX6G2FS34FUCAWFU4Q9TGIB7R,europarl,political party european level rule regarding funding,european level,0.35,1,1,1,0,252.0
3FULMHZ7OUXR381811OH58HTEDWM47,europarl,et also supported report adoption report result conciliation committee apparently conciliation committee proceed straightforwardly quickly positive implement recovery plan european economy implement stated aim plan,european economy,0.3055555555555556,1,1,1,0,290.0
3P7RGTLO6EDBF9HMPQLS3YBPHIXKAB,europarl,overstate important term regime shift alignment fishery regulation many maritime activity,fishery regulation,0.3088235294117647,1,1,1,1,252.0
3RDTX9JRTY19FB0XEQIJ3YVJ5GF97F,europarl,conflict georgia also gas crisis ukraine two example periodic crisis instability affecting region,periodic crisis,0.3088235294117647,1,1,1,0,260.5
3PEG1BH7AERGYJMEV4LOY9VVZ0IKB6,europarl,yes protect fragility arctic environment,arctic environment,0.3088235294117647,1,1,1,0,0.0
37SOB9Z0SSXMFU0J1BIJVQAY08AL3J,europarl,dear colleague today multilateral multipolar world europe america work together partnership global stability enlightened value believe,global stability,0.30952380952380953,1,1,1,1,0.0
3BS6ERDL9372E1Z97WITJGED1QAD61,europarl,drawn attention plenary session document recommendation second reading circulation,second reading,0.3125,1,1,1,0,589.5
32TMVRKDGNYCIJZ470EY0QGYU87845,europarl,mr president mr vicepresident commission honourable member delighted see subject today debate future european aerospace industry industry embodies europe forwardlooking approach high technology potential future growth make considerable contribution achieving goal lisbon strategy growth employment airbus prominent project,prominent project,0.3125,1,1,1,0,0.0
3QGHA0EA0J07TJGVKI4RMKPQM7RWBE,europarl,draft general budget 2007 section ii iv v vi vii viii vote,general budget,0.3125,1,1,1,0,542.5
3P4ZBJFX2V3X60SBPKQN5AGB15JWFW,europarl,madam president lady gentleman request application urgent procedure put u morning implementation rule 134 rule procedure submitted u council last week relates said proposal council regulation establishing multiannual recovery plan bluefin tuna eastern atlantic mediterranean,urgent procedure,0.3125,1,1,1,1,0.0
3MQKOF1EE2O08GEFYEVXHADQPS3DW2,europarl,therefore ask request urgent procedure rejected,urgent procedure,0.44565217391304346,1,1,1,1,0.0
3Q9SPIIRWJM2A9B3E44VR95K4P6WAJ,europarl,right passenger travelling sea inland waterway right passenger bus coach transport debate,coach transport,0.3125,1,1,1,0,254.5
3S829FDFT21FXGJ58JRJJTRXYU9DXV,europarl,mr president regulation came parliament first reading opposed attempt allow mercury stored salt mine also underground facility adapted waste disposal,underground facility,0.3152173913043478,1,1,1,0,241.5
30U1YOGZGAW71ZX6E9LWKLA5JF7DSN,europarl,key definition framed differently different country number member state independent public oversight long way short 27,long way,0.3152173913043478,1,0,0,0,573.0
32K26U12DNONTREA84Q1V8UCIJ1DVS,europarl,must therefore think carefully message want send european commission adapts research policy major challenge day,research policy,0.3152173913043478,1,1,1,0,273.0
3O4VWC1GEW6GK4CJYQ66FBX6WJ53JZ,europarl,madam president world food summit last week rome latest series highlevel event organised year food security agriculture featured prominently january madrid july laquila september new york pittsburgh well meeting committee world food security last month,food security,0.3157894736842105,1,1,0,0,546.0
3OPLMF3EU5NTJYTTJU2Y44845P1LNZ,europarl,many country troop significant number civil personnel country,civil personnel,0.3157894736842105,1,1,1,1,495.0
3Y40HMYLL1I1EIURUEH8TTVLKU3XUO,europarl,europe leader agreed put globalisation centre policy agenda commission busy equipping european union tool need using tool whole range concern european citizen share,whole range,0.3157894736842105,1,1,1,0,553.5
3CO05SML7V5110WZN8XWF4LQ3OF0RT,europarl,intention review ensure europe vital tool defending worker business unfair trade continuing work effectively possible especially taking account dramatic change global economy european business operate global supply chain mix economic interest amongst european business inevitably becoming complex difficult judge call,global economy,0.3157894736842105,1,1,1,0,290.0
3XU9MCX6VOC8XAZD2V1AYSE50MZR24,europarl,proof first deputy prime minster spanish government mara teresa fernndez de la vega case acting representative presidency council european union attending highlevel segment going begin council 13th session,spanish government,0.3157894736842105,1,1,1,0,297.0
35O6H0UNLSGJYJZNC9UZU8VQAFWJ55,europarl,would like inform house received letter president european council herman van rompuy informs european council decision consult european parliament proposal spanish government concerning composition european parliament seek parliament consent convene convention matter,spanish government,0.33333333333333337,1,1,1,0,297.0
3BAKUKE49HC18PHHJR1WT9408GLR1N,europarl,long way unequal treatment woman pension remedy committee woman right gender equality wished predicate report,unequal treatment,0.3157894736842105,1,1,1,1,264.5
